{
  "diagnostics": {
    "http": [
      {
        "age_seconds": 67853,
        "attempts": 2,
        "bypass_age_seconds": null,
        "bypass_cache_status": "MISS",
        "bypass_error": null,
        "bypass_sha256": "fad0117702fe5c4bc7d2acd057dcc8b4687b9eda268772f427f1d52607f54b84",
        "bypass_url": "https://www.inia.uy/sites/default/files/gras/contenidogras/Reportes/agroclima/AlertaOvinos/WRF/Chill_wrf20261014.png?cb=76e2aa7532dd",
        "cache_bypassed": true,
        "cache_status": "HIT",
        "canonical_sha256": "ea664d9e56d9da9761112773eb732e404a280b316989be3b98c16837681b08a2",
        "content_length": 104352,
        "content_type": "image/png",
        "elapsed_ms": 1254,
        "error": null,
        "etag": "\"6acf7cd4-197a0\"",
        "http_status": 200,
        "last_modified": "Wed, 14 Oct 2026 13:00:04 GMT",
        "requested_at": "2026-10-14T15:11:43.411304+00:00",
        "sha256": "fad0117702fe5c4bc7d2acd057dcc8b4687b9eda268772f427f1d52607f54b84",
        "source_url": "https://www.inia.uy/sites/default/files/gras/contenidogras/Reportes/agroclima/AlertaOvinos/WRF/Chill_wrf20261014.png",
        "stale_reason": "Respuesta servida por el borde (HIT) con Age=67853 s (18.8 h), por encima de las 12 h toleradas"
      },
      {
        "age_seconds": 67850,
        "attempts": 2,
        "bypass_age_seconds": null,
        "bypass_cache_status": "MISS",
        "bypass_error": null,
        "bypass_sha256": "17f0c9b3e7be3486803bfb12eecbf405fe1922a03244c675973ffc59e11262c2",
        "bypass_url": "https://www.inia.uy/sites/default/files/gras/contenidogras/Reportes/agroclima/AlertaOvinos/WRF/Chill_wrf20261015.png?cb=76e2aa7532dd",
        "cache_bypassed": true,
        "cache_status": "HIT",
        "canonical_sha256": "ad0b763addc449d1a529d51e08dc9b7576d02ef12c32000396a6a2c7c2800a14",
        "content_length": 107598,
        "content_type": "image/png",
        "elapsed_ms": 1029,
        "error": null,
        "etag": "\"6acf7cd4-1a44e\"",
        "http_status": 200,
        "last_modified": "Wed, 14 Oct 2026 13:00:04 GMT",
        "requested_at": "2026-10-14T15:11:43.411304+00:00",
        "sha256": "17f0c9b3e7be3486803bfb12eecbf405fe1922a03244c675973ffc59e11262c2",
        "source_url": "https://www.inia.uy/sites/default/files/gras/contenidogras/Reportes/agroclima/AlertaOvinos/WRF/Chill_wrf20261015.png",
        "stale_reason": "Respuesta servida por el borde (HIT) con Age=67850 s (18.8 h), por encima de las 12 h toleradas"
      },
      {
        "age_seconds": null,
        "attempts": 1,
        "bypass_age_seconds": null,
        "bypass_cache_status": null,
        "bypass_error": null,
        "bypass_sha256": null,
        "bypass_url": null,
        "cache_bypassed": false,
        "cache_status": "MISS",
        "canonical_sha256": "08497e2b99c3fe89f282c695f5c748cb4a8b4d076f6cdd2c0e06806de4deeb1d",
        "content_length": 111101,
        "content_type": "image/png",
        "elapsed_ms": 1568,
        "error": null,
        "etag": "\"6acf7cd4-1b1fd\"",
        "http_status": 200,
        "last_modified": "Wed, 14 Oct 2026 13:00:04 GMT",
        "requested_at": "2026-10-14T15:11:43.411304+00:00",
        "sha256": "08497e2b99c3fe89f282c695f5c748cb4a8b4d076f6cdd2c0e06806de4deeb1d",
        "source_url": "https://www.inia.uy/sites/default/files/gras/contenidogras/Reportes/agroclima/AlertaOvinos/WRF/Chill_wrf20261016.png",
        "stale_reason": null
      },
      {
        "age_seconds": null,
        "attempts": 1,
        "bypass_age_seconds": null,
        "bypass_cache_status": null,
        "bypass_error": null,
        "bypass_sha256": null,
        "bypass_url": null,
        "cache_bypassed": false,
        "cache_status": "MISS",
        "canonical_sha256": "c79b2d83b83bd7a8831c0ef864850301a2eb3794fd6667aff16266314080bb93",
        "content_length": 110279,
        "content_type": "image/png",
        "elapsed_ms": 973,
        "error": null,
        "etag": "\"6acf7cd4-1aec7\"",
        "http_status": 200,
        "last_modified": "Wed, 14 Oct 2026 13:00:04 GMT",
        "requested_at": "2026-10-14T15:11:43.411304+00:00",
        "sha256": "c79b2d83b83bd7a8831c0ef864850301a2eb3794fd6667aff16266314080bb93",
        "source_url": "https://www.inia.uy/sites/default/files/gras/contenidogras/Reportes/agroclima/AlertaOvinos/WRF/Chill_wrf20261017.png",
        "stale_reason": null
      },
      {
        "age_seconds": null,
        "attempts": 1,
        "bypass_age_seconds": null,
        "bypass_cache_status": null,
        "bypass_error": null,
        "bypass_sha256": null,
        "bypass_url": null,
        "cache_bypassed": false,
        "cache_status": "MISS",
        "canonical_sha256": "f0262aa5f9651d224693698be9a91eb3890e890ae0c02d11b7aa90c4fb661286",
        "content_length": 108255,
        "content_type": "image/png",
        "elapsed_ms": 918,
        "error": null,
        "etag": "\"6acf7cd4-1a6df\"",
        "http_status": 200,
        "last_modified": "Wed, 14 Oct 2026 13:00:04 GMT",
        "requested_at": "2026-10-14T15:11:43.411304+00:00",
        "sha256": "f0262aa5f9651d224693698be9a91eb3890e890ae0c02d11b7aa90c4fb661286",
        "source_url": "https://www.inia.uy/sites/default/files/gras/contenidogras/Reportes/agroclima/AlertaOvinos/WRF/Chill_wrf20261018.png",
        "stale_reason": null
      }
    ],
    "notes": [
      "El WRF completo es la fuente primaria. WRF_mini sólo se usa como respaldo de una fecha cuyo WRF completo no fue interpretable, con su propia calibración y regla precautoria.",
      "Cada miniatura se fecha por el lote al que pertenece (batch_run_date + índice), no por el día en que se la descarga.",
      "Una fecha que ningún producto pudo resolver se publica como NO_DETERMINADO / SIN_DATOS, nunca como SIN_RIESGO."
    ],
    "wrf_mini": {
      "batch_id": "34d2ebe34d6c4970",
      "batch_run_date": "2026-10-14",
      "batch_run_date_source": "Last-Modified coincidente de los miembros (hora de Uruguay)",
      "observations": [
        {
          "age_seconds": 67865,
          "attempts": 2,
          "bypass_age_seconds": null,
          "bypass_cache_status": "MISS",
          "bypass_error": null,
          "bypass_sha256": "5d58961e310626ec4241306b7a5a63bdfd2b1888a76c727f607063312382f8a6",
          "bypass_url": "https://www.inia.uy/sites/default/files/gras/contenidogras/Reportes/agroclima/AlertaOvinos/WRF_mini/Min_0.png?cb=76e2aa7532dd",
          "cache_bypassed": true,
          "cache_status": "HIT",
          "canonical_sha256": "b2aee37b45f9ab684296fda2c94cdc7ab16e683782b0ccbfd35a3f9d18aa3177",
          "content_length": 10662,
          "content_type": "image/png",
          "elapsed_ms": 1599,
          "error": null,
          "etag": "\"6acf7cd4-29a6\"",
          "http_status": 200,
          "index": 0,
          "last_modified": "Wed, 14 Oct 2026 13:00:04 GMT",
          "requested_at": "2026-10-14T15:11:43.411304+00:00",
          "sha256": "5d58961e310626ec4241306b7a5a63bdfd2b1888a76c727f607063312382f8a6",
          "source_url": "https://www.inia.uy/sites/default/files/gras/contenidogras/Reportes/agroclima/AlertaOvinos/WRF_mini/Min_0.png",
          "stale_reason": "Respuesta servida por el borde (HIT) con Age=67865 s (18.9 h), por encima de las 12 h toleradas"
        },
        {
          "age_seconds": 67864,
          "attempts": 2,
          "bypass_age_seconds": null,
          "bypass_cache_status": "MISS",
          "bypass_error": null,
          "bypass_sha256": "508e8ba2afeb5bc5588cfcb9656b86fb3109dbec9cad3ac44bbfb0bcdad2f2c1",
          "bypass_url": "https://www.inia.uy/sites/default/files/gras/contenidogras/Reportes/agroclima/AlertaOvinos/WRF_mini/Min_1.png?cb=76e2aa7532dd",
          "cache_bypassed": true,
          "cache_status": "HIT",
          "canonical_sha256": "b7ae82464d5e81df0521120c6688dcb14ff19a5d7cf2ff3c31da43d936a4e232",
          "content_length": 10764,
          "content_type": "image/png",
          "elapsed_ms": 715,
          "error": null,
          "etag": "\"6acf7cd4-2a0c\"",
          "http_status": 200,
          "index": 1,
          "last_modified": "Wed, 14 Oct 2026 13:00:04 GMT",
          "requested_at": "2026-10-14T15:11:43.411304+00:00",
          "sha256": "508e8ba2afeb5bc5588cfcb9656b86fb3109dbec9cad3ac44bbfb0bcdad2f2c1",
          "source_url": "https://www.inia.uy/sites/default/files/gras/contenidogras/Reportes/agroclima/AlertaOvinos/WRF_mini/Min_1.png",
          "stale_reason": "Respuesta servida por el borde (HIT) con Age=67864 s (18.9 h), por encima de las 12 h toleradas"
        },
        {
          "age_seconds": 67862,
          "attempts": 2,
          "bypass_age_seconds": null,
          "bypass_cache_status": "MISS",
          "bypass_error": null,
          "bypass_sha256": "514f1003c6d7db381830bf086040013e0eb64d9d5d6e0f6a70404c2a98e70f52",
          "bypass_url": "https://www.inia.uy/sites/default/files/gras/contenidogras/Reportes/agroclima/AlertaOvinos/WRF_mini/Min_2.png?cb=76e2aa7532dd",
          "cache_bypassed": true,
          "cache_status": "HIT",
          "canonical_sha256": "fb7e0c7d769f7fdc23a4fd01d54051452a1caa46b0b4eec8fe122e213e6fe79d",
          "content_length": 11062,
          "content_type": "image/png",
          "elapsed_ms": 793,
          "error": null,
          "etag": "\"6acf7cd4-2b36\"",
          "http_status": 200,
          "index": 2,
          "last_modified": "Wed, 14 Oct 2026 13:00:04 GMT",
          "requested_at": "2026-10-14T15:11:43.411304+00:00",
          "sha256": "514f1003c6d7db381830bf086040013e0eb64d9d5d6e0f6a70404c2a98e70f52",
          "source_url": "https://www.inia.uy/sites/default/files/gras/contenidogras/Reportes/agroclima/AlertaOvinos/WRF_mini/Min_2.png",
          "stale_reason": "Respuesta servida por el borde (HIT) con Age=67862 s (18.9 h), por encima de las 12 h toleradas"
        },
        {
          "age_seconds": 67861,
          "attempts": 2,